No.     Time           Source                Destination           Protocol Length Info
      1 0.000000       192.168.60.34         239.255.255.250       SSDP     215    M-SEARCH * HTTP/1.1 

Frame 1: 215 bytes on wire (1720 bits), 215 bytes captured (1720 bits) on interface \Device\NPF_{183E0DE2-8D9C-4B6D-BA2D-B0CD21260514}, id 0
Ethernet II, Src: HewlettP_d3:0e:00 (78:e7:d1:d3:0e:00), Dst: IPv4mcast_7f:ff:fa (01:00:5e:7f:ff:fa)
Internet Protocol Version 4, Src: 192.168.60.34, Dst: 239.255.255.250
User Datagram Protocol, Src Port: 58655, Dst Port: 1900
Simple Service Discovery Protocol

No.     Time           Source                Destination           Protocol Length Info
      2 0.051336       192.168.60.178        224.0.0.252           LLMNR    73     Standard query 0x43fb A BLRMIESSER-09

Frame 2: 73 bytes on wire (584 bits), 73 bytes captured (584 bits) on interface \Device\NPF_{183E0DE2-8D9C-4B6D-BA2D-B0CD21260514}, id 0
Ethernet II, Src: Dell_a2:7a:f1 (48:4d:7e:a2:7a:f1), Dst: IPv4mcast_fc (01:00:5e:00:00:fc)
Internet Protocol Version 4, Src: 192.168.60.178, Dst: 224.0.0.252
User Datagram Protocol, Src Port: 55862, Dst Port: 5355
Link-local Multicast Name Resolution (query)

No.     Time           Source                Destination           Protocol Length Info
      3 0.051938       192.168.60.178        224.0.0.252           LLMNR    73     Standard query 0x73d3 AAAA BLRMIESSER-09

Frame 3: 73 bytes on wire (584 bits), 73 bytes captured (584 bits) on interface \Device\NPF_{183E0DE2-8D9C-4B6D-BA2D-B0CD21260514}, id 0
Ethernet II, Src: Dell_a2:7a:f1 (48:4d:7e:a2:7a:f1), Dst: IPv4mcast_fc (01:00:5e:00:00:fc)
Internet Protocol Version 4, Src: 192.168.60.178, Dst: 224.0.0.252
User Datagram Protocol, Src Port: 57964, Dst Port: 5355
Link-local Multicast Name Resolution (query)

No.     Time           Source                Destination           Protocol Length Info
      4 0.056717       192.168.60.118        239.255.255.250       SSDP     215    M-SEARCH * HTTP/1.1 

Frame 4: 215 bytes on wire (1720 bits), 215 bytes captured (1720 bits) on interface \Device\NPF_{183E0DE2-8D9C-4B6D-BA2D-B0CD21260514}, id 0
Ethernet II, Src: HewlettP_09:21:27 (d4:85:64:09:21:27), Dst: IPv4mcast_7f:ff:fa (01:00:5e:7f:ff:fa)
Internet Protocol Version 4, Src: 192.168.60.118, Dst: 239.255.255.250
User Datagram Protocol, Src Port: 63896, Dst Port: 1900
Simple Service Discovery Protocol

No.     Time           Source                Destination           Protocol Length Info
      5 0.159725       Cisco_d4:59:a9        Spanning-tree-(for-bridges)_00 STP      60     Conf. Root = 0/85/78:ba:f9:c4:9a:41  Cost = 5  Port = 0x8029

Frame 5: 60 bytes on wire (480 bits), 60 bytes captured (480 bits) on interface \Device\NPF_{183E0DE2-8D9C-4B6D-BA2D-B0CD21260514}, id 0
IEEE 802.3 Ethernet 
Logical-Link Control
Spanning Tree Protocol

No.     Time           Source                Destination           Protocol Length Info
      6 0.354621       fe80::5c0d:af71:a4d4:a1ea ff02::1:3             LLMNR    106    Standard query 0xbbfd PTR 27.60.168.192.in-addr.arpa

Frame 6: 106 bytes on wire (848 bits), 106 bytes captured (848 bits) on interface \Device\NPF_{183E0DE2-8D9C-4B6D-BA2D-B0CD21260514}, id 0
Ethernet II, Src: LCFCHeFe_73:2f:24 (54:e1:ad:73:2f:24), Dst: IPv6mcast_01:00:03 (33:33:00:01:00:03)
Internet Protocol Version 6, Src: fe80::5c0d:af71:a4d4:a1ea, Dst: ff02::1:3
User Datagram Protocol, Src Port: 60783, Dst Port: 5355
Link-local Multicast Name Resolution (query)

No.     Time           Source                Destination           Protocol Length Info
      7 0.354847       192.168.60.91         224.0.0.252           LLMNR    86     Standard query 0xbbfd PTR 27.60.168.192.in-addr.arpa

Frame 7: 86 bytes on wire (688 bits), 86 bytes captured (688 bits) on interface \Device\NPF_{183E0DE2-8D9C-4B6D-BA2D-B0CD21260514}, id 0
Ethernet II, Src: LCFCHeFe_73:2f:24 (54:e1:ad:73:2f:24), Dst: IPv4mcast_fc (01:00:5e:00:00:fc)
Internet Protocol Version 4, Src: 192.168.60.91, Dst: 224.0.0.252
User Datagram Protocol, Src Port: 60783, Dst Port: 5355
Link-local Multicast Name Resolution (query)

No.     Time           Source                Destination           Protocol Length Info
      8 0.379584       fe80::5c0d:af71:a4d4:a1ea ff02::1:3             LLMNR    106    Standard query 0x772d PTR 29.60.168.192.in-addr.arpa

Frame 8: 106 bytes on wire (848 bits), 106 bytes captured (848 bits) on interface \Device\NPF_{183E0DE2-8D9C-4B6D-BA2D-B0CD21260514}, id 0
Ethernet II, Src: LCFCHeFe_73:2f:24 (54:e1:ad:73:2f:24), Dst: IPv6mcast_01:00:03 (33:33:00:01:00:03)
Internet Protocol Version 6, Src: fe80::5c0d:af71:a4d4:a1ea, Dst: ff02::1:3
User Datagram Protocol, Src Port: 54589, Dst Port: 5355
Link-local Multicast Name Resolution (query)

No.     Time           Source                Destination           Protocol Length Info
      9 0.379886       192.168.60.91         224.0.0.252           LLMNR    86     Standard query 0x772d PTR 29.60.168.192.in-addr.arpa

Frame 9: 86 bytes on wire (688 bits), 86 bytes captured (688 bits) on interface \Device\NPF_{183E0DE2-8D9C-4B6D-BA2D-B0CD21260514}, id 0
Ethernet II, Src: LCFCHeFe_73:2f:24 (54:e1:ad:73:2f:24), Dst: IPv4mcast_fc (01:00:5e:00:00:fc)
Internet Protocol Version 4, Src: 192.168.60.91, Dst: 224.0.0.252
User Datagram Protocol, Src Port: 54589, Dst Port: 5355
Link-local Multicast Name Resolution (query)

No.     Time           Source                Destination           Protocol Length Info
     10 0.390023       192.168.60.178        192.168.61.255        NBNS     92     Name query NB BLRMIESSER-09<00>

Frame 10: 92 bytes on wire (736 bits), 92 bytes captured (736 bits) on interface \Device\NPF_{183E0DE2-8D9C-4B6D-BA2D-B0CD21260514}, id 0
Ethernet II, Src: Dell_a2:7a:f1 (48:4d:7e:a2:7a:f1), Dst: Broadcast (ff:ff:ff:ff:ff:ff)
Internet Protocol Version 4, Src: 192.168.60.178, Dst: 192.168.61.255
User Datagram Protocol, Src Port: 137, Dst Port: 137
NetBIOS Name Service

No.     Time           Source                Destination           Protocol Length Info
     11 0.402890       Apple_d4:04:a3        Broadcast             ARP      60     Who has 192.168.60.91? Tell 192.168.60.44

Frame 11: 60 bytes on wire (480 bits), 60 bytes captured (480 bits) on interface \Device\NPF_{183E0DE2-8D9C-4B6D-BA2D-B0CD21260514}, id 0
Ethernet II, Src: Apple_d4:04:a3 (0c:4d:e9:d4:04:a3), Dst: Broadcast (ff:ff:ff:ff:ff:ff)
Address Resolution Protocol (request)

No.     Time           Source                Destination           Protocol Length Info
     12 0.402890       fe80::5c0d:af71:a4d4:a1ea ff02::1:3             LLMNR    106    Standard query 0x1417 PTR 44.60.168.192.in-addr.arpa

Frame 12: 106 bytes on wire (848 bits), 106 bytes captured (848 bits) on interface \Device\NPF_{183E0DE2-8D9C-4B6D-BA2D-B0CD21260514}, id 0
Ethernet II, Src: LCFCHeFe_73:2f:24 (54:e1:ad:73:2f:24), Dst: IPv6mcast_01:00:03 (33:33:00:01:00:03)
Internet Protocol Version 6, Src: fe80::5c0d:af71:a4d4:a1ea, Dst: ff02::1:3
User Datagram Protocol, Src Port: 51221, Dst Port: 5355
Link-local Multicast Name Resolution (query)

No.     Time           Source                Destination           Protocol Length Info
     13 0.403132       192.168.60.91         224.0.0.252           LLMNR    86     Standard query 0x1417 PTR 44.60.168.192.in-addr.arpa

Frame 13: 86 bytes on wire (688 bits), 86 bytes captured (688 bits) on interface \Device\NPF_{183E0DE2-8D9C-4B6D-BA2D-B0CD21260514}, id 0
Ethernet II, Src: LCFCHeFe_73:2f:24 (54:e1:ad:73:2f:24), Dst: IPv4mcast_fc (01:00:5e:00:00:fc)
Internet Protocol Version 4, Src: 192.168.60.91, Dst: 224.0.0.252
User Datagram Protocol, Src Port: 51221, Dst Port: 5355
Link-local Multicast Name Resolution (query)

No.     Time           Source                Destination           Protocol Length Info
     14 0.424670       fe80::5c0d:af71:a4d4:a1ea ff02::1:3             LLMNR    106    Standard query 0xe0d9 PTR 45.60.168.192.in-addr.arpa

Frame 14: 106 bytes on wire (848 bits), 106 bytes captured (848 bits) on interface \Device\NPF_{183E0DE2-8D9C-4B6D-BA2D-B0CD21260514}, id 0
Ethernet II, Src: LCFCHeFe_73:2f:24 (54:e1:ad:73:2f:24), Dst: IPv6mcast_01:00:03 (33:33:00:01:00:03)
Internet Protocol Version 6, Src: fe80::5c0d:af71:a4d4:a1ea, Dst: ff02::1:3
User Datagram Protocol, Src Port: 52375, Dst Port: 5355
Link-local Multicast Name Resolution (query)

No.     Time           Source                Destination           Protocol Length Info
     15 0.424820       192.168.60.91         224.0.0.252           LLMNR    86     Standard query 0xe0d9 PTR 45.60.168.192.in-addr.arpa

Frame 15: 86 bytes on wire (688 bits), 86 bytes captured (688 bits) on interface \Device\NPF_{183E0DE2-8D9C-4B6D-BA2D-B0CD21260514}, id 0
Ethernet II, Src: LCFCHeFe_73:2f:24 (54:e1:ad:73:2f:24), Dst: IPv4mcast_fc (01:00:5e:00:00:fc)
Internet Protocol Version 4, Src: 192.168.60.91, Dst: 224.0.0.252
User Datagram Protocol, Src Port: 52375, Dst Port: 5355
Link-local Multicast Name Resolution (query)

No.     Time           Source                Destination           Protocol Length Info
     16 0.597670       192.168.60.178        192.168.61.255        NBNS     92     Name query NB NLB_BL0<00>

Frame 16: 92 bytes on wire (736 bits), 92 bytes captured (736 bits) on interface \Device\NPF_{183E0DE2-8D9C-4B6D-BA2D-B0CD21260514}, id 0
Ethernet II, Src: Dell_a2:7a:f1 (48:4d:7e:a2:7a:f1), Dst: Broadcast (ff:ff:ff:ff:ff:ff)
Internet Protocol Version 4, Src: 192.168.60.178, Dst: 192.168.61.255
User Datagram Protocol, Src Port: 137, Dst Port: 137
NetBIOS Name Service

No.     Time           Source                Destination           Protocol Length Info
     17 0.650485       192.168.60.118        192.168.60.48         TCP      60     7680 → 58562 [PSH, ACK] Seq=1 Ack=1 Win=8208 Len=4

Frame 17: 60 bytes on wire (480 bits), 60 bytes captured (480 bits) on interface \Device\NPF_{183E0DE2-8D9C-4B6D-BA2D-B0CD21260514}, id 0
Ethernet II, Src: HewlettP_09:21:27 (d4:85:64:09:21:27), Dst: HewlettP_29:b7:4d (64:31:50:29:b7:4d)
Internet Protocol Version 4, Src: 192.168.60.118, Dst: 192.168.60.48
Transmission Control Protocol, Src Port: 7680, Dst Port: 58562, Seq: 1, Ack: 1, Len: 4
Data (4 bytes)

0000  00 00 00 00                                       ....

No.     Time           Source                Destination           Protocol Length Info
     18 0.691810       192.168.60.48         192.168.60.118        TCP      54     58562 → 7680 [ACK] Seq=1 Ack=5 Win=1022 Len=0

Frame 18: 54 bytes on wire (432 bits), 54 bytes captured (432 bits) on interface \Device\NPF_{183E0DE2-8D9C-4B6D-BA2D-B0CD21260514}, id 0
Ethernet II, Src: HewlettP_29:b7:4d (64:31:50:29:b7:4d), Dst: HewlettP_09:21:27 (d4:85:64:09:21:27)
Internet Protocol Version 4, Src: 192.168.60.48, Dst: 192.168.60.118
Transmission Control Protocol, Src Port: 58562, Dst Port: 7680, Seq: 1, Ack: 5, Len: 0

No.     Time           Source                Destination           Protocol Length Info
     19 0.843494       fe80::5c0d:af71:a4d4:a1ea ff02::1:3             LLMNR    106    Standard query 0xe0d9 PTR 45.60.168.192.in-addr.arpa

Frame 19: 106 bytes on wire (848 bits), 106 bytes captured (848 bits) on interface \Device\NPF_{183E0DE2-8D9C-4B6D-BA2D-B0CD21260514}, id 0
Ethernet II, Src: LCFCHeFe_73:2f:24 (54:e1:ad:73:2f:24), Dst: IPv6mcast_01:00:03 (33:33:00:01:00:03)
Internet Protocol Version 6, Src: fe80::5c0d:af71:a4d4:a1ea, Dst: ff02::1:3
User Datagram Protocol, Src Port: 52375, Dst Port: 5355
Link-local Multicast Name Resolution (query)

No.     Time           Source                Destination           Protocol Length Info
     20 0.843762       192.168.60.91         224.0.0.252           LLMNR    86     Standard query 0xe0d9 PTR 45.60.168.192.in-addr.arpa

Frame 20: 86 bytes on wire (688 bits), 86 bytes captured (688 bits) on interface \Device\NPF_{183E0DE2-8D9C-4B6D-BA2D-B0CD21260514}, id 0
Ethernet II, Src: LCFCHeFe_73:2f:24 (54:e1:ad:73:2f:24), Dst: IPv4mcast_fc (01:00:5e:00:00:fc)
Internet Protocol Version 4, Src: 192.168.60.91, Dst: 224.0.0.252
User Datagram Protocol, Src Port: 52375, Dst Port: 5355
Link-local Multicast Name Resolution (query)

No.     Time           Source                Destination           Protocol Length Info
     21 1.000126       192.168.60.34         239.255.255.250       SSDP     215    M-SEARCH * HTTP/1.1 

Frame 21: 215 bytes on wire (1720 bits), 215 bytes captured (1720 bits) on interface \Device\NPF_{183E0DE2-8D9C-4B6D-BA2D-B0CD21260514}, id 0
Ethernet II, Src: HewlettP_d3:0e:00 (78:e7:d1:d3:0e:00), Dst: IPv4mcast_7f:ff:fa (01:00:5e:7f:ff:fa)
Internet Protocol Version 4, Src: 192.168.60.34, Dst: 239.255.255.250
User Datagram Protocol, Src Port: 58655, Dst Port: 1900
Simple Service Discovery Protocol

No.     Time           Source                Destination           Protocol Length Info
     22 1.062257       192.168.60.118        239.255.255.250       SSDP     215    M-SEARCH * HTTP/1.1 

Frame 22: 215 bytes on wire (1720 bits), 215 bytes captured (1720 bits) on interface \Device\NPF_{183E0DE2-8D9C-4B6D-BA2D-B0CD21260514}, id 0
Ethernet II, Src: HewlettP_09:21:27 (d4:85:64:09:21:27), Dst: IPv4mcast_7f:ff:fa (01:00:5e:7f:ff:fa)
Internet Protocol Version 4, Src: 192.168.60.118, Dst: 239.255.255.250
User Datagram Protocol, Src Port: 63896, Dst Port: 1900
Simple Service Discovery Protocol

No.     Time           Source                Destination           Protocol Length Info
     23 1.110130       192.168.60.123        224.0.0.252           LLMNR    70     Standard query 0xd116 ANY BLTSP00047

Frame 23: 70 bytes on wire (560 bits), 70 bytes captured (560 bits) on interface \Device\NPF_{183E0DE2-8D9C-4B6D-BA2D-B0CD21260514}, id 0
Ethernet II, Src: Dell_da:53:12 (f8:b1:56:da:53:12), Dst: IPv4mcast_fc (01:00:5e:00:00:fc)
Internet Protocol Version 4, Src: 192.168.60.123, Dst: 224.0.0.252
User Datagram Protocol, Src Port: 64901, Dst Port: 5355
Link-local Multicast Name Resolution (query)

No.     Time           Source                Destination           Protocol Length Info
     24 1.140645       192.168.60.178        192.168.61.255        NBNS     92     Name query NB BLRMIESSER-09<00>

Frame 24: 92 bytes on wire (736 bits), 92 bytes captured (736 bits) on interface \Device\NPF_{183E0DE2-8D9C-4B6D-BA2D-B0CD21260514}, id 0
Ethernet II, Src: Dell_a2:7a:f1 (48:4d:7e:a2:7a:f1), Dst: Broadcast (ff:ff:ff:ff:ff:ff)
Internet Protocol Version 4, Src: 192.168.60.178, Dst: 192.168.61.255
User Datagram Protocol, Src Port: 137, Dst Port: 137
NetBIOS Name Service

No.     Time           Source                Destination           Protocol Length Info
     25 1.219890       192.168.60.67         239.255.255.250       SSDP     215    M-SEARCH * HTTP/1.1 

Frame 25: 215 bytes on wire (1720 bits), 215 bytes captured (1720 bits) on interface \Device\NPF_{183E0DE2-8D9C-4B6D-BA2D-B0CD21260514}, id 0
Ethernet II, Src: HewlettP_98:e7:b9 (78:ac:c0:98:e7:b9), Dst: IPv4mcast_7f:ff:fa (01:00:5e:7f:ff:fa)
Internet Protocol Version 4, Src: 192.168.60.67, Dst: 239.255.255.250
User Datagram Protocol, Src Port: 53713, Dst Port: 1900
Simple Service Discovery Protocol

No.     Time           Source                Destination           Protocol Length Info
     26 1.355173       192.168.60.178        192.168.61.255        NBNS     92     Name query NB MP_BL0<19>

Frame 26: 92 bytes on wire (736 bits), 92 bytes captured (736 bits) on interface \Device\NPF_{183E0DE2-8D9C-4B6D-BA2D-B0CD21260514}, id 0
Ethernet II, Src: Dell_a2:7a:f1 (48:4d:7e:a2:7a:f1), Dst: Broadcast (ff:ff:ff:ff:ff:ff)
Internet Protocol Version 4, Src: 192.168.60.178, Dst: 192.168.61.255
User Datagram Protocol, Src Port: 137, Dst Port: 137
NetBIOS Name Service

No.     Time           Source                Destination           Protocol Length Info
     27 1.411929       192.168.60.53         239.255.255.250       SSDP     179    M-SEARCH * HTTP/1.1 

Frame 27: 179 bytes on wire (1432 bits), 179 bytes captured (1432 bits) on interface \Device\NPF_{183E0DE2-8D9C-4B6D-BA2D-B0CD21260514}, id 0
Ethernet II, Src: HewlettP_97:f0:ff (78:ac:c0:97:f0:ff), Dst: IPv4mcast_7f:ff:fa (01:00:5e:7f:ff:fa)
Internet Protocol Version 4, Src: 192.168.60.53, Dst: 239.255.255.250
User Datagram Protocol, Src Port: 59193, Dst Port: 1900
Simple Service Discovery Protocol

No.     Time           Source                Destination           Protocol Length Info
     28 1.521933       192.168.60.123        224.0.0.252           LLMNR    70     Standard query 0xd116 ANY BLTSP00047

Frame 28: 70 bytes on wire (560 bits), 70 bytes captured (560 bits) on interface \Device\NPF_{183E0DE2-8D9C-4B6D-BA2D-B0CD21260514}, id 0
Ethernet II, Src: Dell_da:53:12 (f8:b1:56:da:53:12), Dst: IPv4mcast_fc (01:00:5e:00:00:fc)
Internet Protocol Version 4, Src: 192.168.60.123, Dst: 224.0.0.252
User Datagram Protocol, Src Port: 64901, Dst Port: 5355
Link-local Multicast Name Resolution (query)

No.     Time           Source                Destination           Protocol Length Info
     29 1.679696       192.168.60.77         192.168.61.255        NBNS     92     Name query NB BLRMIESSER-09<00>

Frame 29: 92 bytes on wire (736 bits), 92 bytes captured (736 bits) on interface \Device\NPF_{183E0DE2-8D9C-4B6D-BA2D-B0CD21260514}, id 0
Ethernet II, Src: Dell_5a:bc:5d (64:00:6a:5a:bc:5d), Dst: Broadcast (ff:ff:ff:ff:ff:ff)
Internet Protocol Version 4, Src: 192.168.60.77, Dst: 192.168.61.255
User Datagram Protocol, Src Port: 137, Dst Port: 137
NetBIOS Name Service

No.     Time           Source                Destination           Protocol Length Info
     30 1.681906       192.168.60.77         224.0.0.252           LLMNR    73     Standard query 0xec70 A BLRMIESSER-09

Frame 30: 73 bytes on wire (584 bits), 73 bytes captured (584 bits) on interface \Device\NPF_{183E0DE2-8D9C-4B6D-BA2D-B0CD21260514}, id 0
Ethernet II, Src: Dell_5a:bc:5d (64:00:6a:5a:bc:5d), Dst: IPv4mcast_fc (01:00:5e:00:00:fc)
Internet Protocol Version 4, Src: 192.168.60.77, Dst: 224.0.0.252
User Datagram Protocol, Src Port: 57746, Dst Port: 5355
Link-local Multicast Name Resolution (query)

No.     Time           Source                Destination           Protocol Length Info
     31 1.683790       192.168.60.77         224.0.0.252           LLMNR    73     Standard query 0x9c69 AAAA BLRMIESSER-09

Frame 31: 73 bytes on wire (584 bits), 73 bytes captured (584 bits) on interface \Device\NPF_{183E0DE2-8D9C-4B6D-BA2D-B0CD21260514}, id 0
Ethernet II, Src: Dell_5a:bc:5d (64:00:6a:5a:bc:5d), Dst: IPv4mcast_fc (01:00:5e:00:00:fc)
Internet Protocol Version 4, Src: 192.168.60.77, Dst: 224.0.0.252
User Datagram Protocol, Src Port: 53886, Dst Port: 5355
Link-local Multicast Name Resolution (query)

No.     Time           Source                Destination           Protocol Length Info
     32 1.757687       192.168.60.120        239.255.255.250       SSDP     179    M-SEARCH * HTTP/1.1 

Frame 32: 179 bytes on wire (1432 bits), 179 bytes captured (1432 bits) on interface \Device\NPF_{183E0DE2-8D9C-4B6D-BA2D-B0CD21260514}, id 0
Ethernet II, Src: HewlettP_30:4c:74 (64:31:50:30:4c:74), Dst: IPv4mcast_7f:ff:fa (01:00:5e:7f:ff:fa)
Internet Protocol Version 4, Src: 192.168.60.120, Dst: 239.255.255.250
User Datagram Protocol, Src Port: 56350, Dst Port: 1900
Simple Service Discovery Protocol

No.     Time           Source                Destination           Protocol Length Info
     33 1.936188       192.168.60.123        224.0.0.252           LLMNR    70     Standard query 0x5c94 ANY BLTSP00047

Frame 33: 70 bytes on wire (560 bits), 70 bytes captured (560 bits) on interface \Device\NPF_{183E0DE2-8D9C-4B6D-BA2D-B0CD21260514}, id 0
Ethernet II, Src: Dell_da:53:12 (f8:b1:56:da:53:12), Dst: IPv4mcast_fc (01:00:5e:00:00:fc)
Internet Protocol Version 4, Src: 192.168.60.123, Dst: 224.0.0.252
User Datagram Protocol, Src Port: 49855, Dst Port: 5355
Link-local Multicast Name Resolution (query)

No.     Time           Source                Destination           Protocol Length Info
     34 1.964231       192.168.60.52         224.0.0.252           LLMNR    86     Standard query 0x6f59 PTR 76.60.168.192.in-addr.arpa

Frame 34: 86 bytes on wire (688 bits), 86 bytes captured (688 bits) on interface \Device\NPF_{183E0DE2-8D9C-4B6D-BA2D-B0CD21260514}, id 0
Ethernet II, Src: Dell_99:ec:ae (98:90:96:99:ec:ae), Dst: IPv4mcast_fc (01:00:5e:00:00:fc)
Internet Protocol Version 4, Src: 192.168.60.52, Dst: 224.0.0.252
User Datagram Protocol, Src Port: 62775, Dst Port: 5355
Link-local Multicast Name Resolution (query)

No.     Time           Source                Destination           Protocol Length Info
     35 1.971976       fe80::7579:a72:9d95:ad9c ff02::1               ICMPv6   86     Neighbor Advertisement fe80::7579:a72:9d95:ad9c (ovr) is at f8:b1:56:da:53:12

Frame 35: 86 bytes on wire (688 bits), 86 bytes captured (688 bits) on interface \Device\NPF_{183E0DE2-8D9C-4B6D-BA2D-B0CD21260514}, id 0
Ethernet II, Src: Dell_da:53:12 (f8:b1:56:da:53:12), Dst: IPv6mcast_01 (33:33:00:00:00:01)
Internet Protocol Version 6, Src: fe80::7579:a72:9d95:ad9c, Dst: ff02::1
Internet Control Message Protocol v6

No.     Time           Source                Destination           Protocol Length Info
     36 2.001190       192.168.60.34         239.255.255.250       SSDP     215    M-SEARCH * HTTP/1.1 

Frame 36: 215 bytes on wire (1720 bits), 215 bytes captured (1720 bits) on interface \Device\NPF_{183E0DE2-8D9C-4B6D-BA2D-B0CD21260514}, id 0
Ethernet II, Src: HewlettP_d3:0e:00 (78:e7:d1:d3:0e:00), Dst: IPv4mcast_7f:ff:fa (01:00:5e:7f:ff:fa)
Internet Protocol Version 4, Src: 192.168.60.34, Dst: 239.255.255.250
User Datagram Protocol, Src Port: 58655, Dst Port: 1900
Simple Service Discovery Protocol

No.     Time           Source                Destination           Protocol Length Info
     37 2.074825       192.168.60.118        239.255.255.250       SSDP     215    M-SEARCH * HTTP/1.1 

Frame 37: 215 bytes on wire (1720 bits), 215 bytes captured (1720 bits) on interface \Device\NPF_{183E0DE2-8D9C-4B6D-BA2D-B0CD21260514}, id 0
Ethernet II, Src: HewlettP_09:21:27 (d4:85:64:09:21:27), Dst: IPv4mcast_7f:ff:fa (01:00:5e:7f:ff:fa)
Internet Protocol Version 4, Src: 192.168.60.118, Dst: 239.255.255.250
User Datagram Protocol, Src Port: 63896, Dst Port: 1900
Simple Service Discovery Protocol

No.     Time           Source                Destination           Protocol Length Info
     38 2.094091       192.168.60.77         224.0.0.252           LLMNR    73     Standard query 0xec70 A BLRMIESSER-09

Frame 38: 73 bytes on wire (584 bits), 73 bytes captured (584 bits) on interface \Device\NPF_{183E0DE2-8D9C-4B6D-BA2D-B0CD21260514}, id 0
Ethernet II, Src: Dell_5a:bc:5d (64:00:6a:5a:bc:5d), Dst: IPv4mcast_fc (01:00:5e:00:00:fc)
Internet Protocol Version 4, Src: 192.168.60.77, Dst: 224.0.0.252
User Datagram Protocol, Src Port: 57746, Dst Port: 5355
Link-local Multicast Name Resolution (query)

No.     Time           Source                Destination           Protocol Length Info
     39 2.095044       192.168.60.77         224.0.0.252           LLMNR    73     Standard query 0x9c69 AAAA BLRMIESSER-09

Frame 39: 73 bytes on wire (584 bits), 73 bytes captured (584 bits) on interface \Device\NPF_{183E0DE2-8D9C-4B6D-BA2D-B0CD21260514}, id 0
Ethernet II, Src: Dell_5a:bc:5d (64:00:6a:5a:bc:5d), Dst: IPv4mcast_fc (01:00:5e:00:00:fc)
Internet Protocol Version 4, Src: 192.168.60.77, Dst: 224.0.0.252
User Datagram Protocol, Src Port: 53886, Dst Port: 5355
Link-local Multicast Name Resolution (query)

No.     Time           Source                Destination           Protocol Length Info
     40 2.105343       192.168.60.178        192.168.61.255        NBNS     92     Name query NB MP_BL0<19>

Frame 40: 92 bytes on wire (736 bits), 92 bytes captured (736 bits) on interface \Device\NPF_{183E0DE2-8D9C-4B6D-BA2D-B0CD21260514}, id 0
Ethernet II, Src: Dell_a2:7a:f1 (48:4d:7e:a2:7a:f1), Dst: Broadcast (ff:ff:ff:ff:ff:ff)
Internet Protocol Version 4, Src: 192.168.60.178, Dst: 192.168.61.255
User Datagram Protocol, Src Port: 137, Dst Port: 137
NetBIOS Name Service

No.     Time           Source                Destination           Protocol Length Info
     41 2.114076       192.168.60.141        224.0.0.252           LLMNR    70     Standard query 0xe04b ANY BLTSP01669

Frame 41: 70 bytes on wire (560 bits), 70 bytes captured (560 bits) on interface \Device\NPF_{183E0DE2-8D9C-4B6D-BA2D-B0CD21260514}, id 0
Ethernet II, Src: Dell_85:c9:e9 (8c:ec:4b:85:c9:e9), Dst: IPv4mcast_fc (01:00:5e:00:00:fc)
Internet Protocol Version 4, Src: 192.168.60.141, Dst: 224.0.0.252
User Datagram Protocol, Src Port: 57888, Dst Port: 5355
Link-local Multicast Name Resolution (query)

No.     Time           Source                Destination           Protocol Length Info
     42 2.162759       Cisco_d4:59:a9        Spanning-tree-(for-bridges)_00 STP      60     Conf. Root = 0/85/78:ba:f9:c4:9a:41  Cost = 5  Port = 0x8029

Frame 42: 60 bytes on wire (480 bits), 60 bytes captured (480 bits) on interface \Device\NPF_{183E0DE2-8D9C-4B6D-BA2D-B0CD21260514}, id 0
IEEE 802.3 Ethernet 
Logical-Link Control
Spanning Tree Protocol

No.     Time           Source                Destination           Protocol Length Info
     43 2.220648       192.168.60.67         239.255.255.250       SSDP     215    M-SEARCH * HTTP/1.1 

Frame 43: 215 bytes on wire (1720 bits), 215 bytes captured (1720 bits) on interface \Device\NPF_{183E0DE2-8D9C-4B6D-BA2D-B0CD21260514}, id 0
Ethernet II, Src: HewlettP_98:e7:b9 (78:ac:c0:98:e7:b9), Dst: IPv4mcast_7f:ff:fa (01:00:5e:7f:ff:fa)
Internet Protocol Version 4, Src: 192.168.60.67, Dst: 239.255.255.250
User Datagram Protocol, Src Port: 53713, Dst Port: 1900
Simple Service Discovery Protocol

No.     Time           Source                Destination           Protocol Length Info
     44 2.347287       192.168.60.123        224.0.0.252           LLMNR    70     Standard query 0x5c94 ANY BLTSP00047

Frame 44: 70 bytes on wire (560 bits), 70 bytes captured (560 bits) on interface \Device\NPF_{183E0DE2-8D9C-4B6D-BA2D-B0CD21260514}, id 0
Ethernet II, Src: Dell_da:53:12 (f8:b1:56:da:53:12), Dst: IPv4mcast_fc (01:00:5e:00:00:fc)
Internet Protocol Version 4, Src: 192.168.60.123, Dst: 224.0.0.252
User Datagram Protocol, Src Port: 49855, Dst Port: 5355
Link-local Multicast Name Resolution (query)

No.     Time           Source                Destination           Protocol Length Info
     45 2.374890       192.168.60.52         224.0.0.252           LLMNR    86     Standard query 0x6f59 PTR 76.60.168.192.in-addr.arpa

Frame 45: 86 bytes on wire (688 bits), 86 bytes captured (688 bits) on interface \Device\NPF_{183E0DE2-8D9C-4B6D-BA2D-B0CD21260514}, id 0
Ethernet II, Src: Dell_99:ec:ae (98:90:96:99:ec:ae), Dst: IPv4mcast_fc (01:00:5e:00:00:fc)
Internet Protocol Version 4, Src: 192.168.60.52, Dst: 224.0.0.252
User Datagram Protocol, Src Port: 62775, Dst Port: 5355
Link-local Multicast Name Resolution (query)

No.     Time           Source                Destination           Protocol Length Info
     46 2.430631       192.168.60.77         192.168.61.255        NBNS     92     Name query NB BLRMIESSER-09<00>

Frame 46: 92 bytes on wire (736 bits), 92 bytes captured (736 bits) on interface \Device\NPF_{183E0DE2-8D9C-4B6D-BA2D-B0CD21260514}, id 0
Ethernet II, Src: Dell_5a:bc:5d (64:00:6a:5a:bc:5d), Dst: Broadcast (ff:ff:ff:ff:ff:ff)
Internet Protocol Version 4, Src: 192.168.60.77, Dst: 192.168.61.255
User Datagram Protocol, Src Port: 137, Dst Port: 137
NetBIOS Name Service

No.     Time           Source                Destination           Protocol Length Info
     47 2.525376       192.168.60.141        224.0.0.252           LLMNR    70     Standard query 0xe04b ANY BLTSP01669

Frame 47: 70 bytes on wire (560 bits), 70 bytes captured (560 bits) on interface \Device\NPF_{183E0DE2-8D9C-4B6D-BA2D-B0CD21260514}, id 0
Ethernet II, Src: Dell_85:c9:e9 (8c:ec:4b:85:c9:e9), Dst: IPv4mcast_fc (01:00:5e:00:00:fc)
Internet Protocol Version 4, Src: 192.168.60.141, Dst: 224.0.0.252
User Datagram Protocol, Src Port: 57888, Dst Port: 5355
Link-local Multicast Name Resolution (query)

No.     Time           Source                Destination           Protocol Length Info
     48 2.579491       192.168.60.48         204.79.197.200        TLSv1.2  4460   Application Data

Frame 48: 4460 bytes on wire (35680 bits), 4460 bytes captured (35680 bits) on interface \Device\NPF_{183E0DE2-8D9C-4B6D-BA2D-B0CD21260514}, id 0
Ethernet II, Src: HewlettP_29:b7:4d (64:31:50:29:b7:4d), Dst: Cisco_0c:d2:70 (f4:0f:1b:0c:d2:70)
Internet Protocol Version 4, Src: 192.168.60.48, Dst: 204.79.197.200
Transmission Control Protocol, Src Port: 53405, Dst Port: 443, Seq: 1, Ack: 1, Len: 4406
Transport Layer Security

No.     Time           Source                Destination           Protocol Length Info
     49 2.579572       192.168.60.48         204.79.197.200        TLSv1.2  840    Application Data

Frame 49: 840 bytes on wire (6720 bits), 840 bytes captured (6720 bits) on interface \Device\NPF_{183E0DE2-8D9C-4B6D-BA2D-B0CD21260514}, id 0
Ethernet II, Src: HewlettP_29:b7:4d (64:31:50:29:b7:4d), Dst: Cisco_0c:d2:70 (f4:0f:1b:0c:d2:70)
Internet Protocol Version 4, Src: 192.168.60.48, Dst: 204.79.197.200
Transmission Control Protocol, Src Port: 53405, Dst Port: 443, Seq: 4407, Ack: 1, Len: 786
Transport Layer Security

No.     Time           Source                Destination           Protocol Length Info
     50 2.580025       192.168.60.48         13.107.6.159          TLSv1.2  124    Application Data

Frame 50: 124 bytes on wire (992 bits), 124 bytes captured (992 bits) on interface \Device\NPF_{183E0DE2-8D9C-4B6D-BA2D-B0CD21260514}, id 0
Ethernet II, Src: HewlettP_29:b7:4d (64:31:50:29:b7:4d), Dst: Cisco_0c:d2:70 (f4:0f:1b:0c:d2:70)
Internet Protocol Version 4, Src: 192.168.60.48, Dst: 13.107.6.159
Transmission Control Protocol, Src Port: 61613, Dst Port: 443, Seq: 1, Ack: 1, Len: 70
Transport Layer Security

No.     Time           Source                Destination           Protocol Length Info
     51 2.580070       192.168.60.48         13.107.6.159          TLSv1.2  208    Application Data

Frame 51: 208 bytes on wire (1664 bits), 208 bytes captured (1664 bits) on interface \Device\NPF_{183E0DE2-8D9C-4B6D-BA2D-B0CD21260514}, id 0
Ethernet II, Src: HewlettP_29:b7:4d (64:31:50:29:b7:4d), Dst: Cisco_0c:d2:70 (f4:0f:1b:0c:d2:70)
Internet Protocol Version 4, Src: 192.168.60.48, Dst: 13.107.6.159
Transmission Control Protocol, Src Port: 61613, Dst Port: 443, Seq: 71, Ack: 1, Len: 154
Transport Layer Security

No.     Time           Source                Destination           Protocol Length Info
     52 2.588823       204.79.197.200        192.168.60.48         TCP      60     443 → 53405 [ACK] Seq=1 Ack=1441 Win=16425 Len=0

Frame 52: 60 bytes on wire (480 bits), 60 bytes captured (480 bits) on interface \Device\NPF_{183E0DE2-8D9C-4B6D-BA2D-B0CD21260514}, id 0
Ethernet II, Src: Cisco_0c:d2:70 (f4:0f:1b:0c:d2:70), Dst: HewlettP_29:b7:4d (64:31:50:29:b7:4d)
Internet Protocol Version 4, Src: 204.79.197.200, Dst: 192.168.60.48
Transmission Control Protocol, Src Port: 443, Dst Port: 53405, Seq: 1, Ack: 1441, Len: 0

No.     Time           Source                Destination           Protocol Length Info
     53 2.588823       204.79.197.200        192.168.60.48         TCP      60     443 → 53405 [ACK] Seq=1 Ack=2881 Win=16419 Len=0

Frame 53: 60 bytes on wire (480 bits), 60 bytes captured (480 bits) on interface \Device\NPF_{183E0DE2-8D9C-4B6D-BA2D-B0CD21260514}, id 0
Ethernet II, Src: Cisco_0c:d2:70 (f4:0f:1b:0c:d2:70), Dst: HewlettP_29:b7:4d (64:31:50:29:b7:4d)
Internet Protocol Version 4, Src: 204.79.197.200, Dst: 192.168.60.48
Transmission Control Protocol, Src Port: 443, Dst Port: 53405, Seq: 1, Ack: 2881, Len: 0

No.     Time           Source                Destination           Protocol Length Info
     54 2.589168       204.79.197.200        192.168.60.48         TCP      60     443 → 53405 [ACK] Seq=1 Ack=4407 Win=16425 Len=0

Frame 54: 60 bytes on wire (480 bits), 60 bytes captured (480 bits) on interface \Device\NPF_{183E0DE2-8D9C-4B6D-BA2D-B0CD21260514}, id 0
Ethernet II, Src: Cisco_0c:d2:70 (f4:0f:1b:0c:d2:70), Dst: HewlettP_29:b7:4d (64:31:50:29:b7:4d)
Internet Protocol Version 4, Src: 204.79.197.200, Dst: 192.168.60.48
Transmission Control Protocol, Src Port: 443, Dst Port: 53405, Seq: 1, Ack: 4407, Len: 0

No.     Time           Source                Destination           Protocol Length Info
     55 2.589168       204.79.197.200        192.168.60.48         TCP      60     443 → 53405 [ACK] Seq=1 Ack=5193 Win=16421 Len=0

Frame 55: 60 bytes on wire (480 bits), 60 bytes captured (480 bits) on interface \Device\NPF_{183E0DE2-8D9C-4B6D-BA2D-B0CD21260514}, id 0
Ethernet II, Src: Cisco_0c:d2:70 (f4:0f:1b:0c:d2:70), Dst: HewlettP_29:b7:4d (64:31:50:29:b7:4d)
Internet Protocol Version 4, Src: 204.79.197.200, Dst: 192.168.60.48
Transmission Control Protocol, Src Port: 443, Dst Port: 53405, Seq: 1, Ack: 5193, Len: 0

No.     Time           Source                Destination           Protocol Length Info
     56 2.589565       13.107.6.159          192.168.60.48         TCP      60     443 → 61613 [ACK] Seq=1 Ack=71 Win=16419 Len=0

Frame 56: 60 bytes on wire (480 bits), 60 bytes captured (480 bits) on interface \Device\NPF_{183E0DE2-8D9C-4B6D-BA2D-B0CD21260514}, id 0
Ethernet II, Src: Cisco_0c:d2:70 (f4:0f:1b:0c:d2:70), Dst: HewlettP_29:b7:4d (64:31:50:29:b7:4d)
Internet Protocol Version 4, Src: 13.107.6.159, Dst: 192.168.60.48
Transmission Control Protocol, Src Port: 443, Dst Port: 61613, Seq: 1, Ack: 71, Len: 0

No.     Time           Source                Destination           Protocol Length Info
     57 2.589565       13.107.6.159          192.168.60.48         TCP      60     443 → 61613 [ACK] Seq=1 Ack=225 Win=16425 Len=0

Frame 57: 60 bytes on wire (480 bits), 60 bytes captured (480 bits) on interface \Device\NPF_{183E0DE2-8D9C-4B6D-BA2D-B0CD21260514}, id 0
Ethernet II, Src: Cisco_0c:d2:70 (f4:0f:1b:0c:d2:70), Dst: HewlettP_29:b7:4d (64:31:50:29:b7:4d)
Internet Protocol Version 4, Src: 13.107.6.159, Dst: 192.168.60.48
Transmission Control Protocol, Src Port: 443, Dst Port: 61613, Seq: 1, Ack: 225, Len: 0

No.     Time           Source                Destination           Protocol Length Info
     58 2.664341       204.79.197.200        192.168.60.48         TLSv1.2  197    Application Data

Frame 58: 197 bytes on wire (1576 bits), 197 bytes captured (1576 bits) on interface \Device\NPF_{183E0DE2-8D9C-4B6D-BA2D-B0CD21260514}, id 0
Ethernet II, Src: Cisco_0c:d2:70 (f4:0f:1b:0c:d2:70), Dst: HewlettP_29:b7:4d (64:31:50:29:b7:4d)
Internet Protocol Version 4, Src: 204.79.197.200, Dst: 192.168.60.48
Transmission Control Protocol, Src Port: 443, Dst Port: 53405, Seq: 1, Ack: 5193, Len: 143
Transport Layer Security

No.     Time           Source                Destination           Protocol Length Info
     59 2.703947       192.168.60.48         204.79.197.200        TCP      54     53405 → 443 [ACK] Seq=5193 Ack=144 Win=1029 Len=0

Frame 59: 54 bytes on wire (432 bits), 54 bytes captured (432 bits) on interface \Device\NPF_{183E0DE2-8D9C-4B6D-BA2D-B0CD21260514}, id 0
Ethernet II, Src: HewlettP_29:b7:4d (64:31:50:29:b7:4d), Dst: Cisco_0c:d2:70 (f4:0f:1b:0c:d2:70)
Internet Protocol Version 4, Src: 192.168.60.48, Dst: 204.79.197.200
Transmission Control Protocol, Src Port: 53405, Dst Port: 443, Seq: 5193, Ack: 144, Len: 0

No.     Time           Source                Destination           Protocol Length Info
     60 2.819565       192.168.60.117        192.168.60.48         TCP      66     65376 → 7680 [SYN] Seq=0 Win=64240 Len=0 MSS=1460 WS=256 SACK_PERM=1

Frame 60: 66 bytes on wire (528 bits), 66 bytes captured (528 bits) on interface \Device\NPF_{183E0DE2-8D9C-4B6D-BA2D-B0CD21260514}, id 0
Ethernet II, Src: Dell_bf:26:6b (18:03:73:bf:26:6b), Dst: HewlettP_29:b7:4d (64:31:50:29:b7:4d)
Internet Protocol Version 4, Src: 192.168.60.117, Dst: 192.168.60.48
Transmission Control Protocol, Src Port: 65376, Dst Port: 7680, Seq: 0, Len: 0

No.     Time           Source                Destination           Protocol Length Info
     61 2.819728       192.168.60.48         192.168.60.117        TCP      66     7680 → 65376 [SYN, ACK] Seq=0 Ack=1 Win=65535 Len=0 MSS=1460 WS=256 SACK_PERM=1

Frame 61: 66 bytes on wire (528 bits), 66 bytes captured (528 bits) on interface \Device\NPF_{183E0DE2-8D9C-4B6D-BA2D-B0CD21260514}, id 0
Ethernet II, Src: HewlettP_29:b7:4d (64:31:50:29:b7:4d), Dst: Dell_bf:26:6b (18:03:73:bf:26:6b)
Internet Protocol Version 4, Src: 192.168.60.48, Dst: 192.168.60.117
Transmission Control Protocol, Src Port: 7680, Dst Port: 65376, Seq: 0, Ack: 1, Len: 0

No.     Time           Source                Destination           Protocol Length Info
     62 2.820272       192.168.60.117        192.168.60.48         TCP      60     65376 → 7680 [ACK] Seq=1 Ack=1 Win=2102272 Len=0

Frame 62: 60 bytes on wire (480 bits), 60 bytes captured (480 bits) on interface \Device\NPF_{183E0DE2-8D9C-4B6D-BA2D-B0CD21260514}, id 0
Ethernet II, Src: Dell_bf:26:6b (18:03:73:bf:26:6b), Dst: HewlettP_29:b7:4d (64:31:50:29:b7:4d)
Internet Protocol Version 4, Src: 192.168.60.117, Dst: 192.168.60.48
Transmission Control Protocol, Src Port: 65376, Dst Port: 7680, Seq: 1, Ack: 1, Len: 0

No.     Time           Source                Destination           Protocol Length Info
     63 2.820512       192.168.60.117        192.168.60.48         TCP      129    65376 → 7680 [PSH, ACK] Seq=1 Ack=1 Win=2102272 Len=75

Frame 63: 129 bytes on wire (1032 bits), 129 bytes captured (1032 bits) on interface \Device\NPF_{183E0DE2-8D9C-4B6D-BA2D-B0CD21260514}, id 0
Ethernet II, Src: Dell_bf:26:6b (18:03:73:bf:26:6b), Dst: HewlettP_29:b7:4d (64:31:50:29:b7:4d)
Internet Protocol Version 4, Src: 192.168.60.117, Dst: 192.168.60.48
Transmission Control Protocol, Src Port: 65376, Dst Port: 7680, Seq: 1, Ack: 1, Len: 75
Data (75 bytes)

0000  0e 53 77 61 72 6d 20 70 72 6f 74 6f 63 6f 6c 00   .Swarm protocol.
0010  00 00 00 00 10 00 00 93 fd cb c5 f8 4b 72 b2 65   ............Kr.e
0020  1c d7 17 a6 2c ec 32 8c 7b dc 19 d1 63 45 85 36   ....,.2.{...cE.6
0030  ca fe ea 4f ff 25 8b ed 03 19 9d e3 3b ea 4e a0   ...O.%......;.N.
0040  26 17 2b 0d 94 cd 4d 00 00 00 00                  &.+...M....

No.     Time           Source                Destination           Protocol Length Info
     64 2.820864       192.168.60.48         192.168.60.117        TCP      129    7680 → 65376 [PSH, ACK] Seq=1 Ack=76 Win=2102272 Len=75

Frame 64: 129 bytes on wire (1032 bits), 129 bytes captured (1032 bits) on interface \Device\NPF_{183E0DE2-8D9C-4B6D-BA2D-B0CD21260514}, id 0
Ethernet II, Src: HewlettP_29:b7:4d (64:31:50:29:b7:4d), Dst: Dell_bf:26:6b (18:03:73:bf:26:6b)
Internet Protocol Version 4, Src: 192.168.60.48, Dst: 192.168.60.117
Transmission Control Protocol, Src Port: 7680, Dst Port: 65376, Seq: 1, Ack: 76, Len: 75
Data (75 bytes)

0000  0e 53 77 61 72 6d 20 70 72 6f 74 6f 63 6f 6c 00   .Swarm protocol.
0010  00 00 00 00 10 00 00 93 fd cb c5 f8 4b 72 b2 65   ............Kr.e
0020  1c d7 17 a6 2c ec 32 8c 7b dc 19 d1 63 45 85 36   ....,.2.{...cE.6
0030  ca fe ea 4f ff 25 8b 96 f6 eb 5c 1a 0f b8 46 a6   ...O.%....\...F.
0040  9d 8f 7c 08 09 3e 2b 00 00 00 00                  ..|..>+....

No.     Time           Source                Destination           Protocol Length Info
     65 2.821740       192.168.60.117        192.168.60.48         TCP      86     65376 → 7680 [PSH, ACK] Seq=76 Ack=76 Win=2102272 Len=32

Frame 65: 86 bytes on wire (688 bits), 86 bytes captured (688 bits) on interface \Device\NPF_{183E0DE2-8D9C-4B6D-BA2D-B0CD21260514}, id 0
Ethernet II, Src: Dell_bf:26:6b (18:03:73:bf:26:6b), Dst: HewlettP_29:b7:4d (64:31:50:29:b7:4d)
Internet Protocol Version 4, Src: 192.168.60.117, Dst: 192.168.60.48
